{
 "archetype": "make",
 "company": "无锡恒驰汽车零部件有限公司",
 "today": "2026-09-17",
 "clockMin": 540,
 "systems": [],
 "seed": {
  "byObject": {
   "repair": [
    {
     "id": "BX-2609-001",
     "status": "done",
     "values": {
      "device": "CT-01",
      "faultType": "机械",
      "desc": "主轴异响，转速上不去",
      "startedAt": "2026-09-17 08:20",
      "photo": 1,
      "urgency": "紧急",
      "expectAt": "2026-09-17 14:00",
      "downtime": "是",
      "reporter": "E-003",
      "handler": "E-122",
      "result": "更换主轴轴承",
      "cost": 1200
     },
     "createdBy": {
      "slot": "submitter",
      "title": "班组长",
      "id": "E-003"
     },
     "assignee": "E-122",
     "version": 4,
     "createdAt": -2330,
     "updatedAt": -1945,
     "history": [
      {
       "seq": 1,
       "actionEn": "submit",
       "action": "提交",
       "by": "E-003",
       "role": "班组长",
       "atMin": -2330,
       "from": null,
       "to": "open"
      },
      {
       "seq": 2,
       "actionEn": "accept",
       "action": "接单",
       "by": "E-122",
       "role": "设备员",
       "atMin": -2295,
       "from": "open",
       "to": "accepted"
      },
      {
       "seq": 3,
       "actionEn": "start",
       "action": "开始处理",
       "by": "E-122",
       "role": "设备员",
       "atMin": -2205,
       "from": "accepted",
       "to": "doing"
      },
      {
       "seq": 4,
       "actionEn": "complete",
       "action": "完成",
       "by": "E-122",
       "role": "设备员",
       "atMin": -1945,
       "from": "doing",
       "to": "done"
      }
     ]
    },
    {
     "id": "BX-2609-002",
     "status": "done",
     "values": {
      "device": "PA-01",
      "faultType": "电气",
      "desc": "机械手卡滞，报警 1012",
      "startedAt": "2026-09-17 08:20",
      "photo": 2,
      "urgency": "停机",
      "expectAt": "2026-09-17 14:00",
      "downtime": "是",
      "reporter": "E-004",
      "handler": "E-123",
      "result": "清理机械手并润滑",
      "cost": 300
     },
     "createdBy": {
      "slot": "submitter",
      "title": "班组长",
      "id": "E-004"
     },
     "assignee": "E-123",
     "version": 4,
     "createdAt": -820,
     "updatedAt": -538,
     "history": [
      {
       "seq": 1,
       "actionEn": "submit",
       "action": "提交",
       "by": "E-004",
       "role": "班组长",
       "atMin": -820,
       "from": null,
       "to": "open"
      },
      {
       "seq": 2,
       "actionEn": "accept",
       "action": "接单",
       "by": "E-123",
       "role": "设备员",
       "atMin": -778,
       "from": "open",
       "to": "accepted"
      },
      {
       "seq": 3,
       "actionEn": "start",
       "action": "开始处理",
       "by": "E-123",
       "role": "设备员",
       "atMin": -718,
       "from": "accepted",
       "to": "doing"
      },
      {
       "seq": 4,
       "actionEn": "complete",
       "action": "完成",
       "by": "E-123",
       "role": "设备员",
       "atMin": -538,
       "from": "doing",
       "to": "done"
      }
     ]
    },
    {
     "id": "BX-2609-003",
     "status": "done",
     "values": {
      "device": "PA-02",
      "faultType": "液压",
      "desc": "液压站压力上不去",
      "startedAt": "2026-09-17 08:20",
      "photo": 1,
      "urgency": "一般",
      "expectAt": "2026-09-17 14:00",
      "downtime": "是",
      "reporter": "E-003",
      "handler": "E-122",
      "result": "更换液压泵密封",
      "cost": 2600
     },
     "createdBy": {
      "slot": "submitter",
      "title": "班组长",
      "id": "E-003"
     },
     "assignee": "E-122",
     "version": 4,
     "createdAt": -500,
     "updatedAt": -52,
     "history": [
      {
       "seq": 1,
       "actionEn": "submit",
       "action": "提交",
       "by": "E-003",
       "role": "班组长",
       "atMin": -500,
       "from": null,
       "to": "open"
      },
      {
       "seq": 2,
       "actionEn": "accept",
       "action": "接单",
       "by": "E-122",
       "role": "设备员",
       "atMin": -472,
       "from": "open",
       "to": "accepted"
      },
      {
       "seq": 3,
       "actionEn": "start",
       "action": "开始处理",
       "by": "E-122",
       "role": "设备员",
       "atMin": -352,
       "from": "accepted",
       "to": "doing"
      },
      {
       "seq": 4,
       "actionEn": "complete",
       "action": "完成",
       "by": "E-122",
       "role": "设备员",
       "atMin": -52,
       "from": "doing",
       "to": "done"
      }
     ]
    },
    {
     "id": "BX-2609-004",
     "status": "open",
     "values": {
      "device": "PB-01",
      "faultType": "机械",
      "desc": "加热区温度波动大",
      "startedAt": "2026-09-17 08:20",
      "photo": 2,
      "urgency": "紧急",
      "expectAt": "2026-09-17 14:00",
      "downtime": "是",
      "reporter": "E-003"
     },
     "createdBy": {
      "slot": "submitter",
      "title": "班组长",
      "id": "E-003"
     },
     "assignee": null,
     "version": 1,
     "createdAt": 380,
     "updatedAt": 380,
     "history": [
      {
       "seq": 1,
       "actionEn": "submit",
       "action": "提交",
       "by": "E-003",
       "role": "班组长",
       "atMin": 380,
       "from": null,
       "to": "open"
      }
     ]
    },
    {
     "id": "BX-2609-005",
     "status": "doing",
     "values": {
      "device": "CNC-01",
      "faultType": "电气",
      "desc": "主轴异响，转速上不去",
      "startedAt": "2026-09-17 08:20",
      "photo": 1,
      "urgency": "停机",
      "expectAt": "2026-09-17 14:00",
      "downtime": "是",
      "reporter": "E-003",
      "handler": "E-122"
     },
     "createdBy": {
      "slot": "submitter",
      "title": "班组长",
      "id": "E-003"
     },
     "assignee": "E-122",
     "version": 3,
     "createdAt": 470,
     "updatedAt": 600,
     "history": [
      {
       "seq": 1,
       "actionEn": "submit",
       "action": "提交",
       "by": "E-003",
       "role": "班组长",
       "atMin": 470,
       "from": null,
       "to": "open"
      },
      {
       "seq": 2,
       "actionEn": "accept",
       "action": "接单",
       "by": "E-122",
       "role": "设备员",
       "atMin": 500,
       "from": "open",
       "to": "accepted"
      },
      {
       "seq": 3,
       "actionEn": "start",
       "action": "开始处理",
       "by": "E-122",
       "role": "设备员",
       "atMin": 600,
       "from": "accepted",
       "to": "doing"
      }
     ]
    },
    {
     "id": "BX-2609-006",
     "status": "accepted",
     "values": {
      "device": "CNC-02",
      "faultType": "液压",
      "desc": "机械手卡滞，报警 1012",
      "startedAt": "2026-09-17 08:20",
      "photo": 2,
      "urgency": "一般",
      "expectAt": "2026-09-17 14:00",
      "downtime": "是",
      "reporter": "E-004",
      "handler": "E-123"
     },
     "createdBy": {
      "slot": "submitter",
      "title": "班组长",
      "id": "E-004"
     },
     "assignee": "E-123",
     "version": 2,
     "createdAt": 490,
     "updatedAt": 534,
     "history": [
      {
       "seq": 1,
       "actionEn": "submit",
       "action": "提交",
       "by": "E-004",
       "role": "班组长",
       "atMin": 490,
       "from": null,
       "to": "open"
      },
      {
       "seq": 2,
       "actionEn": "accept",
       "action": "接单",
       "by": "E-123",
       "role": "设备员",
       "atMin": 534,
       "from": "open",
       "to": "accepted"
      }
     ]
    },
    {
     "id": "BX-2609-007",
     "status": "accepted",
     "values": {
      "device": "CNC-03",
      "faultType": "机械",
      "desc": "液压站压力上不去",
      "startedAt": "2026-09-17 08:20",
      "photo": 1,
      "urgency": "紧急",
      "expectAt": "2026-09-17 14:00",
      "downtime": "是",
      "reporter": "E-003",
      "handler": "E-122"
     },
     "createdBy": {
      "slot": "submitter",
      "title": "班组长",
      "id": "E-003"
     },
     "assignee": "E-122",
     "version": 2,
     "createdAt": 510,
     "updatedAt": 548,
     "history": [
      {
       "seq": 1,
       "actionEn": "submit",
       "action": "提交",
       "by": "E-003",
       "role": "班组长",
       "atMin": 510,
       "from": null,
       "to": "open"
      },
      {
       "seq": 2,
       "actionEn": "accept",
       "action": "接单",
       "by": "E-122",
       "role": "设备员",
       "atMin": 548,
       "from": "open",
       "to": "accepted"
      }
     ]
    },
    {
     "id": "BX-2609-008",
     "status": "open",
     "values": {
      "device": "CNC-04",
      "faultType": "电气",
      "desc": "加热区温度波动大",
      "startedAt": "2026-09-17 08:20",
      "photo": 2,
      "urgency": "停机",
      "expectAt": "2026-09-17 14:00",
      "downtime": "是",
      "reporter": "E-003"
     },
     "createdBy": {
      "slot": "submitter",
      "title": "班组长",
      "id": "E-003"
     },
     "assignee": null,
     "version": 1,
     "createdAt": 515,
     "updatedAt": 515,
     "history": [
      {
       "seq": 1,
       "actionEn": "submit",
       "action": "提交",
       "by": "E-003",
       "role": "班组长",
       "atMin": 515,
       "from": null,
       "to": "open"
      }
     ]
    }
   ],
   "expense": [
    {
     "id": "BS-2609-001",
     "status": "pending",
     "values": {
      "type": "差旅",
      "amount": 2360,
      "date": "2026-09-12",
      "desc": "赴苏州客户现场技术支持",
      "invoice": 3,
      "photo": 3,
      "applicant": "E-003"
     },
     "createdBy": {
      "slot": "submitter",
      "title": "班组长",
      "id": "E-003"
     },
     "assignee": null,
     "version": 1,
     "createdAt": -940,
     "updatedAt": -940,
     "history": [
      {
       "seq": 1,
       "actionEn": "submit",
       "action": "提交",
       "by": "E-003",
       "role": "班组长",
       "atMin": -940,
       "from": null,
       "to": "pending"
      }
     ]
    },
    {
     "id": "BS-2609-002",
     "status": "approved",
     "values": {
      "type": "交通",
      "amount": 680,
      "date": "2026-09-12",
      "desc": "市内送样打车",
      "invoice": 1,
      "photo": 1,
      "applicant": "E-004",
      "opinion": "同意"
     },
     "createdBy": {
      "slot": "submitter",
      "title": "班组长",
      "id": "E-004"
     },